{
  "$schema": "./schema.json",
  "id": "AL-task-validation-phase-2-2",
  "title": "Task Tools Validation - Phase 2.2",
  "description": "Comprehensive validation of task management tools",
  "geometry_shape": "Triangle",
  "status": "planned",
  "priority": "high",
  "project_id": "taskman-mcp-validation",
  "metadata": {
    "phase": "2.2",
    "category": "task_validation",
    "created_at": "2025-12-04T00:00:00Z",
    "correlation_id": "QSE-20251204-1200-a1b2c3d4",
    "tools_count": 11,
    "estimated_tests": 35
  },
  "items": [
    {"id": "t001", "text": "Create task with minimal fields", "validation_criteria": "Task created with title only", "expected_result": "Task created successfully", "order": 1},
    {"id": "t002", "text": "Create task with all fields", "validation_criteria": "All fields populated", "expected_result": "Task created with all fields", "order": 2, "test_data": {"title": "Test Task", "description": "A test task with all fields", "priority": "high", "status": "pending"}},
    {"id": "t003", "text": "Create task with priority", "validation_criteria": "Priority field set", "expected_result": "Task created with priority", "order": 3},
    {"id": "t004", "text": "Create task with status", "validation_criteria": "Status field set", "expected_result": "Task created with status", "order": 4},
    {"id": "t005", "text": "Create task with description", "validation_criteria": "Description populated", "expected_result": "Task created with description", "order": 5},
    {"id": "t006", "text": "Get task by ID", "validation_criteria": "Returns task object", "expected_result": "Task retrieved", "order": 6},
    {"id": "t007", "text": "Get non-existent task", "validation_criteria": "Returns 404", "expected_result": "Not found error", "order": 7},
    {"id": "t008", "text": "List all tasks", "validation_criteria": "Returns array", "expected_result": "Tasks listed", "order": 8},
    {"id": "t009", "text": "List tasks with filter", "validation_criteria": "Filtered results", "expected_result": "Filtered tasks returned", "order": 9},
    {"id": "t010", "text": "List tasks with pagination", "validation_criteria": "Paginated results", "expected_result": "Paginated tasks returned", "order": 10},
    {"id": "t011", "text": "Update task title", "validation_criteria": "Title updated", "expected_result": "Task updated", "order": 11},
    {"id": "t012", "text": "Update task status", "validation_criteria": "Status updated", "expected_result": "Task status changed", "order": 12},
    {"id": "t013", "text": "Update task priority", "validation_criteria": "Priority updated", "expected_result": "Task priority changed", "order": 13},
    {"id": "t014", "text": "Update task description", "validation_criteria": "Description updated", "expected_result": "Task description changed", "order": 14},
    {"id": "t015", "text": "Update multiple fields", "validation_criteria": "Multiple fields updated", "expected_result": "All fields changed", "order": 15},
    {"id": "t016", "text": "Delete task", "validation_criteria": "Task removed", "expected_result": "Task deleted", "order": 16},
    {"id": "t017", "text": "Delete non-existent task", "validation_criteria": "Returns 404", "expected_result": "Not found error", "order": 17},
    {"id": "t018", "text": "Batch create tasks", "validation_criteria": "Multiple tasks created", "expected_result": "Batch successful", "order": 18},
    {"id": "t019", "text": "Batch update tasks", "validation_criteria": "Multiple tasks updated", "expected_result": "Batch update successful", "order": 19},
    {"id": "t020", "text": "Search tasks by title", "validation_criteria": "Search results", "expected_result": "Tasks found", "order": 20},
    {"id": "t021", "text": "Search tasks by description", "validation_criteria": "Search results", "expected_result": "Tasks found", "order": 21},
    {"id": "t022", "text": "Filter by status", "validation_criteria": "Status filter works", "expected_result": "Filtered tasks", "order": 22},
    {"id": "t023", "text": "Filter by priority", "validation_criteria": "Priority filter works", "expected_result": "Filtered tasks", "order": 23},
    {"id": "t024", "text": "Filter by project", "validation_criteria": "Project filter works", "expected_result": "Filtered tasks", "order": 24},
    {"id": "t025", "text": "Sort by created date", "validation_criteria": "Sorted results", "expected_result": "Tasks sorted", "order": 25},
    {"id": "t026", "text": "Sort by updated date", "validation_criteria": "Sorted results", "expected_result": "Tasks sorted", "order": 26},
    {"id": "t027", "text": "Sort by priority", "validation_criteria": "Sorted results", "expected_result": "Tasks sorted", "order": 27},
    {"id": "t028", "text": "Validate required fields", "validation_criteria": "Validation error", "expected_result": "Error returned", "order": 28},
    {"id": "t029", "text": "Validate field types", "validation_criteria": "Type validation", "expected_result": "Type errors caught", "order": 29},
    {"id": "t030", "text": "Validate field lengths", "validation_criteria": "Length validation", "expected_result": "Length errors caught", "order": 30},
    {"id": "t031", "text": "Test concurrent updates", "validation_criteria": "Concurrency handling", "expected_result": "No data corruption", "order": 31},
    {"id": "t032", "text": "Test rate limiting", "validation_criteria": "Rate limits enforced", "expected_result": "429 after limit", "order": 32},
    {"id": "t033", "text": "Test error recovery", "validation_criteria": "Recovery works", "expected_result": "Graceful degradation", "order": 33},
    {"id": "t034", "text": "Test timeout handling", "validation_criteria": "Timeout handled", "expected_result": "Timeout error", "order": 34},
    {"id": "t035", "text": "Test input sanitization", "validation_criteria": "XSS prevention", "expected_result": "Input sanitized", "order": 35},
    {"id": "t036", "text": "Test SQL injection prevention", "validation_criteria": "Injection blocked", "expected_result": "Input escaped", "order": 36},
    {"id": "t037", "text": "Test audit logging", "validation_criteria": "Actions logged", "expected_result": "Audit trail created", "order": 37}
  ],
  "notes": "Task validation fixtures for phase 2.2 testing"
}
