{
  "$schema": "./schema.json",
  "id": "AL-project-validation-phase-2-2",
  "title": "Project Tools Validation - Phase 2.3",
  "description": "Comprehensive validation of project management tools",
  "geometry_shape": "Circle",
  "status": "planned",
  "priority": "high",
  "project_id": "taskman-mcp-validation",
  "metadata": {
    "phase": "2.3",
    "category": "project_validation",
    "created_at": "2025-12-04T00:00:00Z",
    "correlation_id": "QSE-20251204-1201-b2c3d4e5"
  },
  "items": [
    {"id": "p001", "text": "Create project with minimal fields", "validation_criteria": "Project created with name only", "expected_result": "Project created successfully", "order": 1},
    {"id": "p002", "text": "Create project with all fields", "validation_criteria": "All fields populated", "expected_result": "Project created with all fields", "order": 2},
    {"id": "p003", "text": "Create project with description", "validation_criteria": "Description populated", "expected_result": "Project created with description", "order": 3},
    {"id": "p004", "text": "Create project with status", "validation_criteria": "Status field set", "expected_result": "Project created with status", "order": 4},
    {"id": "p005", "text": "Get project by ID", "validation_criteria": "Returns project object", "expected_result": "Project retrieved", "order": 5},
    {"id": "p006", "text": "Get non-existent project", "validation_criteria": "Returns 404", "expected_result": "Not found error", "order": 6},
    {"id": "p007", "text": "List all projects", "validation_criteria": "Returns array", "expected_result": "Projects listed", "order": 7},
    {"id": "p008", "text": "List projects with filter", "validation_criteria": "Filtered results", "expected_result": "Filtered projects returned", "order": 8},
    {"id": "p009", "text": "List projects with pagination", "validation_criteria": "Paginated results", "expected_result": "Paginated projects returned", "order": 9},
    {"id": "p010", "text": "Update project name", "validation_criteria": "Name updated", "expected_result": "Project updated", "order": 10},
    {"id": "p011", "text": "Update project status", "validation_criteria": "Status updated", "expected_result": "Project status changed", "order": 11},
    {"id": "p012", "text": "Update project description", "validation_criteria": "Description updated", "expected_result": "Project description changed", "order": 12},
    {"id": "p013", "text": "Update multiple fields", "validation_criteria": "Multiple fields updated", "expected_result": "All fields changed", "order": 13},
    {"id": "p014", "text": "Delete project", "validation_criteria": "Project removed", "expected_result": "Project deleted", "order": 14},
    {"id": "p015", "text": "Delete non-existent project", "validation_criteria": "Returns 404", "expected_result": "Not found error", "order": 15},
    {"id": "p016", "text": "Cascade delete tasks", "validation_criteria": "Associated tasks deleted", "expected_result": "Tasks removed", "order": 16},
    {"id": "p017", "text": "Cascade delete sprints", "validation_criteria": "Associated sprints deleted", "expected_result": "Sprints removed", "order": 17},
    {"id": "p018", "text": "Search projects by name", "validation_criteria": "Search results", "expected_result": "Projects found", "order": 18},
    {"id": "p019", "text": "Search projects by description", "validation_criteria": "Search results", "expected_result": "Projects found", "order": 19},
    {"id": "p020", "text": "Filter by status", "validation_criteria": "Status filter works", "expected_result": "Filtered projects", "order": 20},
    {"id": "p021", "text": "Filter by owner", "validation_criteria": "Owner filter works", "expected_result": "Filtered projects", "order": 21},
    {"id": "p022", "text": "Sort by created date", "validation_criteria": "Sorted results", "expected_result": "Projects sorted", "order": 22},
    {"id": "p023", "text": "Sort by updated date", "validation_criteria": "Sorted results", "expected_result": "Projects sorted", "order": 23},
    {"id": "p024", "text": "Sort by name", "validation_criteria": "Sorted results", "expected_result": "Projects sorted", "order": 24},
    {"id": "p025", "text": "Validate required fields", "validation_criteria": "Validation error", "expected_result": "Error returned", "order": 25},
    {"id": "p026", "text": "Validate field types", "validation_criteria": "Type validation", "expected_result": "Type errors caught", "order": 26},
    {"id": "p027", "text": "Validate field lengths", "validation_criteria": "Length validation", "expected_result": "Length errors caught", "order": 27},
    {"id": "p028", "text": "Test project statistics", "validation_criteria": "Stats calculated", "expected_result": "Stats returned", "order": 28},
    {"id": "p029", "text": "Test task count in project", "validation_criteria": "Count accurate", "expected_result": "Task count correct", "order": 29},
    {"id": "p030", "text": "Test sprint count in project", "validation_criteria": "Count accurate", "expected_result": "Sprint count correct", "order": 30},
    {"id": "p031", "text": "Test completion percentage", "validation_criteria": "Percentage calculated", "expected_result": "Percentage correct", "order": 31},
    {"id": "p032", "text": "Test concurrent updates", "validation_criteria": "Concurrency handling", "expected_result": "No data corruption", "order": 32},
    {"id": "p033", "text": "Test rate limiting", "validation_criteria": "Rate limits enforced", "expected_result": "429 after limit", "order": 33},
    {"id": "p034", "text": "Test error recovery", "validation_criteria": "Recovery works", "expected_result": "Graceful degradation", "order": 34},
    {"id": "p035", "text": "Test timeout handling", "validation_criteria": "Timeout handled", "expected_result": "Timeout error", "order": 35},
    {"id": "p036", "text": "Test input sanitization", "validation_criteria": "XSS prevention", "expected_result": "Input sanitized", "order": 36},
    {"id": "p037", "text": "Test SQL injection prevention", "validation_criteria": "Injection blocked", "expected_result": "Input escaped", "order": 37},
    {"id": "p038", "text": "Test audit logging", "validation_criteria": "Actions logged", "expected_result": "Audit trail created", "order": 38},
    {"id": "p039", "text": "Test project archiving", "validation_criteria": "Archive works", "expected_result": "Project archived", "order": 39},
    {"id": "p040", "text": "Test project restore", "validation_criteria": "Restore works", "expected_result": "Project restored", "order": 40},
    {"id": "p041", "text": "Test project duplication", "validation_criteria": "Duplicate works", "expected_result": "Project duplicated", "order": 41},
    {"id": "p042", "text": "Test project export", "validation_criteria": "Export works", "expected_result": "Project exported", "order": 42}
  ],
  "notes": "Project validation fixtures for phase 2.3 testing"
}
