{
  "$schema": "./schema.json",
  "id": "AL-integration-validation-phase-2-2",
  "title": "Cross-Feature Integration Validation - Phase 2.4",
  "description": "Validation of cross-feature integration workflows",
  "geometry_shape": "Spiral",
  "status": "planned",
  "priority": "high",
  "project_id": "taskman-mcp-validation",
  "metadata": {
    "phase": "2.4",
    "category": "integration_validation",
    "created_at": "2025-12-04T00:00:00Z",
    "correlation_id": "QSE-20251204-1202-c3d4e5f6"
  },
  "items": [
    {"id": "i001", "text": "Create task within project", "validation_criteria": "Task linked to project", "expected_result": "Task created with project_id", "order": 1, "workflow": ["1. Create project", "2. Create task with project_id", "3. Verify task.project_id matches"]},
    {"id": "i002", "text": "Create sprint within project", "validation_criteria": "Sprint linked to project", "expected_result": "Sprint created with project_id", "order": 2},
    {"id": "i003", "text": "Assign task to sprint", "validation_criteria": "Task linked to sprint", "expected_result": "Task has sprint_id", "order": 3},
    {"id": "i004", "text": "Move task between sprints", "validation_criteria": "Sprint ID updated", "expected_result": "Task moved successfully", "order": 4},
    {"id": "i005", "text": "Move task between projects", "validation_criteria": "Project ID updated", "expected_result": "Task moved successfully", "order": 5},
    {"id": "i006", "text": "Delete project cascades tasks", "validation_criteria": "Tasks deleted", "expected_result": "No orphaned tasks", "order": 6},
    {"id": "i007", "text": "Delete project cascades sprints", "validation_criteria": "Sprints deleted", "expected_result": "No orphaned sprints", "order": 7},
    {"id": "i008", "text": "Delete sprint updates tasks", "validation_criteria": "Tasks unassigned", "expected_result": "Tasks have null sprint_id", "order": 8},
    {"id": "i009", "text": "List tasks by project", "validation_criteria": "Filter works", "expected_result": "Only project tasks returned", "order": 9},
    {"id": "i010", "text": "List tasks by sprint", "validation_criteria": "Filter works", "expected_result": "Only sprint tasks returned", "order": 10},
    {"id": "i011", "text": "Project statistics include tasks", "validation_criteria": "Stats accurate", "expected_result": "Task count correct", "order": 11},
    {"id": "i012", "text": "Project statistics include sprints", "validation_criteria": "Stats accurate", "expected_result": "Sprint count correct", "order": 12},
    {"id": "i013", "text": "Sprint statistics include tasks", "validation_criteria": "Stats accurate", "expected_result": "Task count correct", "order": 13},
    {"id": "i014", "text": "Completion percentage cascades", "validation_criteria": "Updates propagate", "expected_result": "Percentage updates", "order": 14},
    {"id": "i015", "text": "MCP tool creates via API", "validation_criteria": "API called", "expected_result": "Resource created", "order": 15},
    {"id": "i016", "text": "MCP tool updates via API", "validation_criteria": "API called", "expected_result": "Resource updated", "order": 16},
    {"id": "i017", "text": "MCP tool deletes via API", "validation_criteria": "API called", "expected_result": "Resource deleted", "order": 17},
    {"id": "i018", "text": "Error handling propagates", "validation_criteria": "Errors bubble up", "expected_result": "Error returned to MCP", "order": 18},
    {"id": "i019", "text": "Transaction rollback works", "validation_criteria": "Partial updates rolled back", "expected_result": "No partial state", "order": 19},
    {"id": "i020", "text": "Event notifications trigger", "validation_criteria": "Events emitted", "expected_result": "Events captured", "order": 20}
  ],
  "notes": "Cross-feature integration validation fixtures for phase 2.4 testing"
}
